{
  "$schema": "https://json-schema.org/draft/2020-12/schema",
  "$id": "https://schemas.commandlayer.org/schemas/v1.0.0/trust-verification/authenticate/authenticate.request.schema.json",
  "title": "CLAS Trust Verification Authenticate Request",
  "description": "A request to authenticate the identity of an actor, signer, service, key, agent, or caller.",
  "type": "object",
  "additionalProperties": false,
  "required": ["version", "family", "verb", "subject"],
  "properties": {
    "version": { "const": "1.0.0" },
    "family": { "const": "trust-verification" },
    "verb": { "const": "authenticate" },
    "subject": {
      "type": "object",
      "description": "The identity-bearing subject being authenticated.",
      "additionalProperties": true,
      "required": ["type", "id"],
      "properties": {
        "type": { "type": "string", "minLength": 1 },
        "id": { "type": "string", "minLength": 1 },
        "uri": { "type": "string" },
        "claimed_identity": { "type": "string" },
        "content_hash": { "type": "string", "pattern": "^sha256:[a-fA-F0-9]{64}$" }
      }
    },
    "method": {
      "type": "string"
    },
    "credential": {
      "type": "object",
      "additionalProperties": true
    },
    "context": {
      "type": "object",
      "additionalProperties": true
    }
  }
}
